{
  "model_name": "MusicNet-HCFP-Frame-MultiInst",
  "model_type": "aspp",
  "output_classes": 12,
  "label_type": "multi_instrument_frame",
  "timesteps": 128,
  "frame_threshold": 0.5,
  "instrument_threshold": 1.1,
  "onset_threshold": 6,
  "duration_threshold": 0,
  "feature_type": "HCFP",
  "input_channels": [
    0,
    1,
    2,
    3,
    4,
    5,
    6,
    7,
    8,
    9,
    10,
    11
  ],
  "training_settings": {
    "dataset": "MusicNet",
    "epochs": 20,
    "steps": 3000,
    "train_batch_size": 8,
    "val_batch_size": 8,
    "loss_function": "focal",
    "early_stop": 6
  },
  "description": "Information about this model\n            Model name: MusicNet-HCFP-Frame-MultiInst\n            Input feature type: HCFP\n            Input channels: [1, 3]\n            Timesteps: 128\n            Label type: multi_instrument_frame\n            Thresholds:\n                Instrument: 1.1\n                Frame: 0.5\n                Onset: 6\n                Duration: 0\n            Training settings:\n                Previously trained on MusicNet\n                Maximum epochs: 20\n                Steps per epoch: 3000\n                Training batch size: 8\n                Validation batch size: 8\n                Loss function type: focal\n                Early stopping: 6\n        "
}
